Assumption ID,Assumption Statement,Closest Literature Archetype,Primary Source 1,Primary Source 2,Primary Source 3,Validity Verdict,Transferability Caveat,Current Empirical Gate,Status
A1,"True support size is sparse relative to ambient dimension","High-dimensional sparse model selection scaling","https://www.jmlr.org/papers/v7/zhao06a.html","https://doi.org/10.1109/TIT.2009.2016018","https://projecteuclid.org/journals/annals-of-statistics/volume-39/issue-3/High-dimensional-covariance-estimation-by-minimizing-l1-penalized-log-determinant/10.1214/11-AOS949.full","Strongly supported assumption class","Need extension from pairwise precision/operator sparsity to k>=3 hyperedge operators in switching dynamics","tests/test_phase0_steps.py::test_metrics_schema_and_gate_thresholds","Supported class; integrated theorem open"
A2,"Regime-conditioned emissions/operators are separated by a positive margin and transitions are nondegenerate","Identifiability of HMM/SDS with distinct emissions and ergodic transitions","https://proceedings.mlr.press/v235/balsells-rodas24a.html","https://projecteuclid.org/journals/annals-of-statistics/volume-44/issue-6/Finite-state-space-non-parametric-hidden-Markov-models-are-identifiable/10.1214/16-AOS1526.full","https://arxiv.org/abs/1610.08466","Supported in spirit","Exact separation metric for high-order tensor emissions must be formalized in our theorem","results/phase0_switching_sweep/sweep_metrics.json","Supported class; integrated theorem open"
A3,"Noise is sub-Gaussian (with robust extension path for heavy tails)","Concentration-driven sparse estimation in dependent high-dimensional models","https://arxiv.org/abs/1311.4175","https://projecteuclid.org/journals/statistical-science/volume-27/issue-4/A-unified-framework-for-high-dimensional-analysis-of-M-estimators/10.1214/12-STS400.full","https://projecteuclid.org/journals/annals-of-statistics/volume-39/issue-3/High-dimensional-covariance-estimation-by-minimizing-l1-penalized-log-determinant/10.1214/11-AOS949.full","Strongly supported assumption class","Need dependence-aware concentration for latent-switching high-order observables","tests/test_phase0_steps.py::test_switching_sweep_gate_when_step15_completed","Supported class; integrated theorem open"
A4,"Design/operator geometry satisfies incoherence/irrepresentable or RE-type condition","Lasso/group-Lasso/graphical selection identifiability geometry","https://www.jmlr.org/papers/v7/zhao06a.html","https://www.jmlr.org/papers/v9/bach08b.html","https://projecteuclid.org/journals/annals-of-statistics/volume-40/issue-4/Latent-variable-graphical-model-selection-via-convex-optimization/10.1214/12-AOS1027.full","Strongly supported assumption family","Need explicit hyperedge-tensor analog and verification statistic","results/rigor_checks/metrics_summary.json","Supported class; integrated theorem open"
A5,"Latent regime process mixes sufficiently fast for effective sample size concentration","Markov-chain concentration and HMM identifiability under ergodicity","https://arxiv.org/abs/1212.2015","https://projecteuclid.org/journals/annals-of-statistics/volume-44/issue-6/Finite-state-space-non-parametric-hidden-Markov-models-are-identifiable/10.1214/16-AOS1526.full","https://proceedings.mlr.press/v235/balsells-rodas24a.html","Supported assumption class","Need explicit translation from spectral gap/mixing time to support-recovery sample complexity in our model","results/phase0_switching_sweep/sweep_metrics.json","Supported class; integrated theorem open"
A6,"Nonzero parameters exceed a beta-min signal floor tied to sample size/noise","Exact support recovery thresholds in sparse estimation","https://doi.org/10.1109/TIT.2009.2016018","https://www.jmlr.org/papers/v7/zhao06a.html","https://projecteuclid.org/journals/annals-of-statistics/volume-39/issue-3/High-dimensional-covariance-estimation-by-minimizing-l1-penalized-log-determinant/10.1214/11-AOS949.full","Strongly supported requirement for exact support claims","Need beta-min formulation for multilinear hyperedge parameters under latent switching","results/phase0/metrics_summary.json","Supported class; integrated theorem open"
